{
  "packageId": "java-jaxrs-charges",
  "goldVersion": "0.1.0",
  "tier": "core",
  "description": "JAX-RS charges API + JPA Charge entity (Fineract-shaped).",
  "platformMinContract": "1.0.0",
  "fixturePath": "fixtures/monorepo/packages/java-jaxrs-charges",
  "changelog": "v0.1.0 initial",
  "nodes": [
    {
      "id": "charges-api",
      "nodeType": "service",
      "match": { "nameContains": "ChargesApi" },
      "interfaces": [
        "GET /v1/charges",
        "GET /v1/charges/{chargeId}",
        "POST /v1/charges"
      ]
    },
    {
      "id": "charge-entity",
      "nodeType": "database",
      "match": { "nameContains": "Charge.java" }
    }
  ],
  "relationships": [],
  "mustNotDetect": [],
  "ignoreCalmNameContains": ["system"],
  "outOfScope": [],
  "expectedPlatformGaps": []
}
